{
  "proposalId": "prop-learn-1790457750266",
  "candidateId": "cand-prop-learn-1790457750266",
  "timestamp": "2026-09-26T21:22:30.265Z",
  "trigger": "human_correction",
  "diagnosis": "Human user correction captured: \"Always enforce strict type guards before mutating session state...\"",
  "targetScope": "rules",
  "targetFile": "rules/01-core-principles.md",
  "proposedMutation": {
    "diffType": "patch_content",
    "content": "\n### 🛡️ Human-Learned Invariant (2026-09-26):\n- Always enforce strict type guards before mutating session state\n"
  },
  "rationale": "Distilled from direct human pairing correction via Antigravity /learn protocol.",
  "governanceStatus": "proposed"
}